Link,Title,Location,Salary,Summary
https://kr.indeed.com/viewjob?jk=bf6d04be8ff513d2,전산팀 개발 담당,Success Korea 서울 역삼동,,"이상~ -학사 이상 / 남녀 무관 -기술요구사항: JAVA/WEB, PYTHON, ORACLE: ERP I/F API, CRAWLING 개발 [우대... 기술요구사항: JAVA/WEB, PYTHON, ORACLE: ERP I/F..."
https://kr.indeed.com/viewjob?jk=a979e53aa387868c,보안개발자(ASAP),Success Korea 서울 삼성동,,"요건] - 보안 취약점 점검 관련 경력 5년이상 - Java, PHP, Python 등의 언어(택1)로 자동화프로그램 개발 가능한 분 - IT인프라에... 5년이상 - Java, PHP, Python 등의 언어(택1)로 자동화프로..."
https://kr.indeed.com/viewjob?jk=bbf36187bf5002f0,서비스 개발 및 관리,Success Korea 서울,,경력 1년 이상 - PHP/ Python 등 웹프로그래밍 경력자 - APM... 출서류] 이력서 경력기술서 자격요건 - 경력 1년 이상 - PHP/ Python 등 웹프로그래밍 경력자 - APM 환경에서 시스템 구축의 전반에 대한...
https://kr.indeed.com/viewjob?jk=c1037225077ca4da,데이터 분석가 (Business Intelligence Analyst),코스닥 상장 중견 게임기업 서울 강남구,"연봉 40,000,000원 - 70,000,000원","데이터 분석 결과를 쉽게 이해할 수 있도록 간결하고 명확한 의사전달 능력 [우대조건] * R, Python, Spark 등의 언어에 대한 이해도 * 모바일 앱SDK 연동 지원 업무 경험(Facebook, Admob..."
https://kr.indeed.com/viewjob?jk=13513ddad0382808,빅데이터 분석,Success Korea 서울 삼성동,,"경험 - 프로그래밍 언어 중 2가지 이상 능숙하게 사용(R, Scala, Python, Java) - 컴퓨터 사이언스 또는 통계 관련 박사학위자 우대... 능숙하게 사용(R, Scala, Python, Java) - 컴퓨터 사이언..."
https://kr.indeed.com/viewjob?jk=a6d0f0030a9ad230,링크샵스 플랫폼 개발 및 유지보수 담당,링크샵스 서울 중구,,"알고리즘 모델링 및 적용 경험 [우대사항] • 인공지능, 머신러닝(기계학습), 빅데이터 관련 석사 우대 • Python, Tensorflow, Keras 경험자 우대 • 대용량 서비스 및 데이터 처리 경험자 우대 • 이미치..."
https://kr.indeed.com/viewjob?jk=bfb3ee6d45d67013,저축은행 디지털금융본부 Data Science 팀 CSS운영 경력자,국내자본 저축은행 서울 구로구,,"략방향구성 [자격요건] - 4년제 정규 대졸 이상 (통계, 수학, 산업공학 전공자 우대) - 통계프로그램(R, Python) 및 엑셀 활용가능자 - CSS운영 관리 경험자 [전형절차] 서류, 면접 1~2회 [제출서류] 이력서..."
https://kr.indeed.com/viewjob?jk=dcc2877b33c5b511,보안 개발전문가,Success Korea 서울 삼성동,,"요건] - 보안 취약점 점검 관련 경력 5년이상 - Java, PHP, Python 등의 언어로 프로그램 개발 필수 - IT인프라에 대한 지식 보유자... 년이상 - Java, PHP, Python 등의 언어로 프로그램 개발 필수..."
https://kr.indeed.com/viewjob?jk=18d4b759113240ca,개인화 추천서비스 개발,Success Korea 서울 삼성동,,"응용시스템 개발 경험 - 다년간의 SQL 활용 경험 - Java 및 Python, Scala 프로그래밍 경험 - 컴퓨터 사이언스 또는 통계 관련 석... SQL 활용 경험 - Java 및 Python, Scala 프로그래밍 경험..."
https://kr.indeed.com/viewjob?jk=e11bc11a4d72cc54,MPK / MPI-SD Joint Postdoctoral Position for Ultrafast Nonli...,POSTECH / Max Planck POSTECH/KOREA Res. Init. 대한민국,,"Experience in computer programming using C/C++ or FORTRAN, Python, Mathematica or Matlab, specially in parallelized schemes..."
https://kr.indeed.com/viewjob?jk=aca0eb99fec4ee19,[어니컴(주)] 데이터 분석가 경력직,어니컴 서울 중구,,프로그래밍 언어 : R 혹은 Python) - 데이터 적재(파일 입출력... 데이터분석|인터넷·IT·통신·모바일·게임>빅데이터·AI(인공지능)> Python|인터넷·IT·통신·모바일·게임>빅데이터·AI(인공지능)>R|인터넷...
https://kr.indeed.com/viewjob?jk=248f25cc0416aa37,Java Backend Software Engineer,하이퍼커넥트 서울,,"개발 또는 DBMS 운영 경험이 있으신 분 AWS 등 클라우드 환경에서의 개발 또는 운영 경험이 있으신 분 Python 사용 경험이 있으신 분 Ansible, Salt, Chef, Puppet, Fabric 등의 DevOps..."
https://kr.indeed.com/viewjob?jk=857aced59dd116dd,Security Developer (보안 개발자),토스 서울 강남구,,"시스템 개발 경험이 있는 분 보안 로그 상관분석 개발 또는 그에 준하는 분석/탐지 기술 개발 경험이 있는 분 Python, JAVA, Go 등의 프로그래밍 언어에 능숙한 분 우대 사항 대용량 데이터 기반의 보안시스템(SIEM..."
https://kr.indeed.com/viewjob?jk=01b7f9d31e668163,Window Desktop Application Developer (C# / .NET),Bepro Company 서울,"연봉 40,000,000원 - 80,000,000원",참고 - React JS (Web) / Kotlin (Android) / Swift (iOS) - Python + Django - AWS lambda + API gateway - MySQL - Google Cloud...
https://kr.indeed.com/viewjob?jk=7ebdf4113ab38d2b,Back-end 개발(경력 - 3년 이상),엔카닷컴 서울 중구,,통신·모바일·게임>응용프로그래머> Python|인터넷·IT·통신·모바일·게임... 게임>웹프로그래머> Python|인터넷·IT·통신·모바일·게임>웹프로그래머>백엔드|인터넷·IT·통신·모바일·게임>빅데이터·AI(인공지능)> Python
https://kr.indeed.com/viewjob?jk=45a8d1ec64004328,"[해외취업] IT 프로그래머,web개발 엔지니어,Java프로그래머,인프라...",SEAGILE 대한민국,"연봉 35,100,000원 - 70,000,000원","외 아래 언어, 스킬 보유자 *개발환경 업무 범위 1.웹개발 엔지니어 -언어: Java、Spring,PHP、 Python, Ruby、java script, JQuery등 -DB: MySQL, Oracle -OS: Linux..."
https://kr.indeed.com/viewjob?jk=b06176c3a7092e0a,Customer Facing Data Scientist,Ever Better Recruitment (EBR) 서울,,ensure appropriate communication Experience in R or Python analysis Up to 50% off-site visits English ability to perform...
https://kr.indeed.com/viewjob?jk=5b8f92a7e1e106aa,2018년도 기후변화감시과 공무직 근로자(연구보조원) 장애인 특별,기상청 대한민국,,"원임용시험령」등 관계법령에 의하여 응시자격을 정지당하지 않은 자 대기과학 관련분야로서 자료처리 및 그래픽( Python, IDL, NCL 등) 등 프로그램밍에 능숙한 자 ※ 대기과학 관련분야: 기상학, 환경학, 지구과학..."
https://kr.indeed.com/viewjob?jk=a8f2de7c03aa263c,4차산업선도인력 빅데이터-IoT 국비지원 교육생,비트컴퓨터 서울 강남구,,"습득 및 프로젝트 수행 후 관련 분야로 취업을 원하는 자 Java, Python 등 기본 프로그래밍 유 경험자 - 선발 우대사항 IT관련 전공학과... 게임>빅데이터·AI(인공지능)> Python|인터넷·IT·통신·모바일·게임..."
https://kr.indeed.com/viewjob?jk=8da5c72baf146123,Site Engineer (Seoul),Motion2AI 서울,,의력과 열정을 가진 분을 찾고 있습니다. 지원자격 필수조건 Linux/Windows 시스템 능숙 C++/ Python/Golang 등 코드 컴파일 및 디버깅 경험 우대조건 물류관련 프로젝트 경험 CS 및 관련 학과 출신...
https://kr.indeed.com/viewjob?jk=525fdab567ce9db2,DevOps 개발자 (백엔드),토이스미스 서울 강남구,,"및 Service Mesh 에 대한 이해 l 서버 관리 자동화 경험 개발스택 l 개발 언어: Golang, python, node l 플랫폼: AWS, Docker Swarm l 라우팅: Route53, Traefik l..."
https://kr.indeed.com/viewjob?jk=2cfd15907402c5cc,DGIST 제2차 계약직 연구원 채용공고,대구경북과학기술원 대구 현풍면,,천원 이내 수행 내용 Machine learning (Deep learning) 알고리즘 개발 Python/Tensorflow 프로그래밍 Matlab/simulink 모의실험 자율주행 자동차 혹은 전문 서비...
https://kr.indeed.com/viewjob?jk=68117cedea15bc83,"기술연구소 정규직 연력(Java, C++, Python, 기타).",파인씨앤아이 서울 송파구,"연봉 35,000,000원","개발 및 AI, 통계분석I) - 경력 : Java 개발경험 2년이상 -개발언어 : Java, C++, Python, Node 등 경력조건 경력 필요경력 2년 0개월 자격면허 병역 병역 특례 무관 외국어 능력 컴퓨터 활용..."
https://kr.indeed.com/viewjob?jk=882ce3f45214f1b1,Junior and/or Senior Engineers for MySQL...,Success Korea 서울,,5 years of work experience in C and Python programming ?Required Minimum of 5 years... experience in C and Python programming...
https://kr.indeed.com/viewjob?jk=d90b5ba4ce618721,"Sr. Solutions Architect, Storage",Amazon Web Services Korea LLC 서울,,"speaking engagements Scripting experience (Powershell, Python, bash, etc.) Bachelors or equivalent work experience..."
https://kr.indeed.com/viewjob?jk=7772fd53bc80acde,Senior Business Analyst (Retail Program...,Coupang 3.1 서울,,ecommerce or internet services business Experience with Python is a plus Experience with financial modeling/forecasting...
https://kr.indeed.com/viewjob?jk=1d98c46b4900b7e6,Pipeline TD,Mofac 서울 서초구,,"지식과 경험 – Cross Platform OS 경험자(Windows, Linux, Mac OS) – Python, MEL, PyQt, PySide, C++ 등 저작도구 관련된 프로그래밍 가능자 – 컴퓨터 그래픽스에 대한..."
https://kr.indeed.com/viewjob?jk=1eba3075433f76da,Frontend/Backend 개발(Full Stack),Xinapse 서울 강남구,,"js, Vue.js, React.js, jQuery, HTML, CSS, javascript, nginx, python 등 Froentend 유경험 • view component 등 확장성을 고려한 시스템 설계 개발 유경험..."
https://kr.indeed.com/viewjob?jk=6e8017195f641e67,O2O Platform Backend 개발자,에이치에너지 서울 강남구,,"작지만 모든 것을 걸고, 기업가 정신으로 사막을 바꿀 길을 놓습니다. [우대사항] 전공계열: 공학계열 - Python 언어에 능숙하신 분 - 시계열 데이터베이스 사용 경험을 가진 분 - kubernetes 를 이용한 백엔드..."
https://kr.indeed.com/viewjob?jk=ecc4154e1f4d28a8,Android Software Engineer,하이퍼커넥트 서울,,"및 네트워크 지식 및 경험 Unit 테스트 작성과 mocking에 대한 경험이 많거나, 흥미가 많으신 분 Python 스크립트 작성 경험 코드 보안에 관심 많으신 분 내부 세미나 또는 블로깅 등의 방법으로 본인의 지식을 공유..."
https://kr.indeed.com/viewjob?jk=d9470ee259f7457b,Cloud Infrastructure Architect,Amazon Web Services Korea LLC 서울,,"through DevOps scripting (E.g. shell, Python, Ruby, Powershell) · Configuration... 스크립팅 (예 : shell, Python, Ruby, Powershell..."
https://kr.indeed.com/viewjob?jk=703240f1af245dde,Cloud Storage Architect 국내 IT 대기업,국내 IT 대기업 서울특별시,,"contribution 경험 - 자동화 구현 솔루션/언어 사용 경험 (Ansible, Chef, puppet, Python, JSON, YAML 등) ※ 우대사항 - 클라우드 스토리지 서비스 구축/운영 경험자 - 스토리지..."
https://kr.indeed.com/viewjob?jk=13da7e1ea8120745,웹프로그래머 (FrontEnd) 기업부설연구소 연구원 #python #j...,넥스텝코리아 서울 용산구,"연봉 30,000,000원",모집직종 웹 개발자(웹 엔지니어·웹 프로그래머) 모집인원 2명 학력 대학_대학교 전공 고용형태 상용직 근무예정지 서울특별시 용산구 효창원로55길 현양빌딩 3층 인근지하철 직무내용 #회사소개 당사는 2001년 설립된 20년차...
https://kr.indeed.com/viewjob?jk=d48c925acb7e4187,IT기획(대리-과장급) 초빙 - 유명 유통사,로이스에이치알 서울,,"에 대한 이해도 . 프로젝트 관리 (PMP 등), 프로그래밍 언어 ( Python, Java 등), RDBMS (OCP 등) 관련 자격증 우대 . 영어... PMP 등), 프로그래밍 언어 ( Python, Java 등), RDBMS..."
https://kr.indeed.com/viewjob?jk=1c48b404fc0661dc,Cloud Support Eng. II (SCD),Amazon Web Services Korea LLC 서울,,"mail services and SMTP · Experience with scripting (i.e. Bash, Python, PowerShell etc.) · Good understanding of networking..."
https://kr.indeed.com/viewjob?jk=e541375257c12d9b,Sr. Back-end Engineer (SCM Systems),Coupang 3.1 서울,,"수립 지원 자격 요건 컴퓨터 공학 또는 엔지니어링 관련 분야 학사학위 취득자 Java, C/C++, Python 활용 소프트웨어 개발 경력 3년 이상인 분 우대 사항 컴퓨터공학 석사 또는 박사학위 eCommerce..."
https://kr.indeed.com/viewjob?jk=c1037225077ca4da,데이터 분석가 (Business Intelligence Analyst),코스닥 상장 중견 게임기업 서울 강남구,"연봉 40,000,000원 - 70,000,000원","데이터 분석 결과를 쉽게 이해할 수 있도록 간결하고 명확한 의사전달 능력 [우대조건] * R, Python, Spark 등의 언어에 대한 이해도 * 모바일 앱SDK 연동 지원 업무 경험(Facebook, Admob..."
https://kr.indeed.com/viewjob?jk=4cd34228af5013fd,DGIST 2019년 제1차 계약직원 공개채용 공고,대구경북과학기술원 대구 현풍면,,"우수자(SPSS, R 등 통계패키지) 외국어(영어) 구사 능력 우수자 Programming(MATLAB, Python, C/C++ 등) 가능자 · 근무기간 : 2019.3.11.~2020.3.10. ※ 단, 재계약 평가에..."
https://kr.indeed.com/viewjob?jk=98c2229e57d4ee1f,전기전자컴퓨터공학부(바이오컴퓨팅연구실) 위촉연구원,광주과학기술원 광주 북구,,"국가보훈대상자(취업보호대상자) 및 장애인은 관련 법령에 의거하여 우대 ② 컴퓨터 프로그램밍 (Matlab, Python, C++등) 가능자 ③ 뇌파 측정 및 분석 2년 이상 경력 ➃ 딥러닝 기술 개발 경험 결격사유..."
https://kr.indeed.com/viewjob?jk=df55d488077e61e3,Sr. Database Engineer (FinTech Platform),Coupang 3.1 서울,,"문성 컴퓨터 공학 또는 관련 분야 학사 학위 소지자 우대 사 항 : 프로그래밍 및 스크립트 스킬 (bash, Python, JAVA, GO 선호) 다양한 종류의 데이터베이스 경험 (MySQL, PostgreSQL, SQL..."
https://kr.indeed.com/viewjob?jk=16dff836029458af,"모바일 앱 서버 개발(Java, Python)",휴먼디지털 서울,,"Python) 자격조건 - 정보시스템 설계 및 데이터 마이닝용 시스템 설계. - 모바일 앱 서비스용 서버 API 설계 및 개발. - 주소록 동기화, Confirmed Push 경험 하신 분 우대. - 자바, Python..."
https://kr.indeed.com/viewjob?jk=fd0ae44d58d1b95d,게임분석 담당자 (신입/경력),더블유게임즈 서울 강남구,,"시간의 법정 근무 시간을 준수하며, 야근을 금지하여 임직원들의 ‘워라벨’ 문화를 선도해 나가고 있습니다. 인터넷·IT·통신·모바일·게임>ERP·시스템분석·설계>빅데이터|인터넷·IT·통신·모바일·게임>웹프로그래머> Python"
https://kr.indeed.com/viewjob?jk=c495ae06620d2544,Junior and/or Senior S/W Engineers for C...,Success Korea 서울,,5 years of work experience in C and Python programming ?Minimum of 3 years of work... experience in C and Python programming...
https://kr.indeed.com/viewjob?jk=0bb6ea3353ad59dc,청주기상지청 연구원(기간제 근로자),기상청 대한민국,,"원격탐사자료 특성 분석 ㅇ 지역별 호우 임계값 산정 및 안개 예측지수 개발 검증 지원 ㅇ 프로그램 언어( Python, 포트란, C, JAVA), 통계프로그램(SSPA, R), 서버운영(유닉스, 리눅스) 등 유경험자 ㅇ..."
https://kr.indeed.com/viewjob?jk=934ef372363794c8,[ADOP/2년 연속 청년친화강소] Ad platform Develope...,애드오피 서울 강남구,,"록하기 지원양식 커리어 온라인 이력서 전형절차 및 제출서류 전형절차 직무/산업 직무별(직종) 웹프로그래머JAVA, PHP, Python HTML코딩.퍼블리셔CSS, HTML5 산업별(업종) 광고.홍보.전시 광고기획, 광고제작"
https://kr.indeed.com/viewjob?jk=f5518c7184bf0f10,"AI,BIG DATA개발 경력직",비스퀘어 부산 해운대구,,"- 개발 경력 3년 이상(학원, 교육 이수기간 제외) - 개발 언어 C++, Go, Java, PHP, Python, Nodejs 가능자 - 모바일 개발 언어 Java, Kotlin, Objective-c, Swift 가능자..."
https://kr.indeed.com/viewjob?jk=f2e8324d211ea289,데이터프로덕트 서버 개발자 (2년 이상),우아한 형제들 서울 송파구,,운영 경험을 보유하신 분 [우대사항] - Spring batch 등을 활용한 배치 개발경험을 보유하신 분 - Python(Flask/Django)을 활용한 서비스 개발경험을 보유하신 분 - 머신러닝에 대한 이해를 갖추신 분...
https://kr.indeed.com/viewjob?jk=f79f6cd3e91fcc1a,"Principal, Data Engineer (EDW Data Proce...",Coupang 3.1 서울,,"Hadoop 및 Spark 을 포함하여 빅 데이터 플랫폼 개발 경험 Python, Java 혹은 Scala를 이용한 개발 경험 전형 절차 및 기타사... development using Python, Java or Scala..."
https://kr.indeed.com/viewjob?jk=04f3458db4cc1f14,데이터 엔지니어,에이치알 코리아 대한민국,,"유명 it 회사 Position 1: 데이터 엔지니어(대리~차장급 분야 별로 여러 명 채용) - JAVA 또는 Python 개발 가능자 또는 DBA, DW 설계 가능자 - Database / SQL 에 대한 중급 이해도 보유..."
https://kr.indeed.com/viewjob?jk=60c38beac39270b1,Full Stack Developer (Internal Products),토스 서울 강남구,,"수 있는 분 우대 사항 Python/Django 기반의 서비스 개발 경험이 있는 분 React 개발 경험이 있는 분 RDB 쿼리 최적화 경험이 있는 분 토스를 구성하는 기술 Python, Django MTV, Django..."
https://kr.indeed.com/viewjob?jk=35b6381bfc05576b,Server Engineering Manager,레이니스트 서울,,"8년 이상 서버 엔지니어링 경험 보유 1년 이상 팀 매니징 경험 보유 Golang/Java(Kotlin)/ Python 중 하나 이상에 전문성을 보유, 고도화된 서비스 설계 및 개발 경험 보유 다양한 도구 및 툴을 활용하여..."
https://kr.indeed.com/viewjob?jk=fd381f2481608bb1,Ericsson-LG Enterprise 경력 개발자 (추가 ),에릭슨엘지 서울 금천구,,웹프로그래머>Servlet|인터넷·IT·통신·모바일·게임>웹프로그래머> Python|인터넷·IT·통신·모바일·게임>웹프로그래머>ASP|인터넷·IT·통신... 통신·모바일·게임>응용프로그래머> Python|인터넷·IT·통신·모바일·게임...
https://kr.indeed.com/viewjob?jk=719aaaeffd746a04,FPGA 플랫폼 엔지니어(딥러닝 하드웨어 프로세서 개발),딥엑스 성남 분당구,"연봉 40,000,000원 - 99,990,000원","logic analyzer 사용 경험(Chip Scope/SignalTap) - Language: Python/Perl(<x... c="""" c - Vivado 또는 Synplify 또는 Quartus II 경험 [우대..."
https://kr.indeed.com/viewjob?jk=116009dbf59211ed,퍼즐데이터 역량있는 데이터 분석가,주식회사퍼즐데이터 서울 역삼동,,"데이터 마이닝 및 통계분석에 대한 전반적인 이해 3. 관련분야(산업공학, 통계 등) 전공 4. R or Python 사용 능력 * 이런 분은 더욱 좋아요. 1. 프로세스 마이닝 지식 보유자 2. 관련분야 대학원 전공 3..."
https://kr.indeed.com/viewjob?jk=e38f22d6852a857a,Sales Engineer (APAC),Sendbird 서울,,"language... JavaScript, Swift, Ruby, C-Sharp, Python Strong organization, time management, and project planning..."
https://kr.indeed.com/viewjob?jk=615168b399422305,Software Engineer - Back-end Web,Sendbird 서울,,maintaining back-end web applications Proficient in Python and Django or equivalents Expert level knowledge of running...
https://kr.indeed.com/viewjob?jk=1241d1e756b15ce4,[배민서비스실] 검색서비스 개발자,우아한 형제들 서울 송파구,,"분 - AWS를 활용한 개발, 운영 경험이 있으신 분 - 빌드/테스트/배포 자동화 경험이 있으신 분 - Python 개발 경험이 있으신 분 - Hadoop, Spark 등 오픈소스 플랫폼 활용 경험이 있으신 분 - 다양한..."
https://kr.indeed.com/viewjob?jk=dd60454d08055f15,[대형보험사] 빅데이터 엔지니어 (사원~대리급),커리어라임즈 서울,,"SQL 숙련 구사 - ETL 툴(DataStage 등) 운용 기술 - Python, Java, R, Scala 중 1개 이상 사용 가능 [우대조건... 게임>빅데이터·AI(인공지능)> Python|인터넷·IT·통신·모바일·게임..."
https://kr.indeed.com/viewjob?jk=48ace3aa027982bc,Cloud Service 개발 및 운영,LINE Plus corporation 성남 서현역,,"Function Service) 개발 및 운영 고도화 및 운영 고도화 [자격요건] - Golang, Python으로 개발 하는것에 능숙하고 언어에 대해 깊은 이해가 있는자 - OS에 대한 이해가 있고 특히 Linux..."
https://kr.indeed.com/viewjob?jk=0056aa891a04f264,디지털 트윈 / Web-XR 개발 (SW),클레이웍스(주) 서울 충무로역,,지원 희망자는 공통적으로 다음과 같은 자격을 갖추고 있어야 합니다. 1. Java/Javascript/ Python 등으로 실무 코딩이 가능해야 합니다. 2. R&D 업무 수행을 위해 영어 기술 문서의 원활한 독해 능력을 필요...
https://kr.indeed.com/viewjob?jk=80d3108dade97b0f,Back-end Developer,"Miso, inc 서울",,"이런 분과 함께하고 싶습니다] 백엔드 개발 경력 3년 이상 Ruby, Python, Go, Node.js 중 하나 이상의 언어에 능숙하신 분 새로운... Data Science: Go, Python Collaboration..."
https://kr.indeed.com/viewjob?jk=d760522e2b9e8e15,2016년도 상반기 국립기상과학원 기간제근로자(소프트웨어기사),기상청 대한민국,,"고사항 - 석사 이상, 기후모델자료 처리 유경험자 우대 - 유닉스 또는 리눅스 서버운영, C, Java, 또는 python 등 유경험자 우대 - 국가기상슈퍼컴센터 관사 이용 가능 - 자격 및 경력에 따른 보수 조정 가능 2..."
https://kr.indeed.com/viewjob?jk=1961cdd73f62c880,"Specialized Solutions Architect III, Ana...",Amazon Web Services Korea LLC 서울,,"Knowledge... least one or more programing languages... Python, Java and Scala. · Hands on experience leading large..."
https://kr.indeed.com/viewjob?jk=e11bc11a4d72cc54,MPK / MPI-SD Joint Postdoctoral Position for Ultrafast Nonli...,POSTECH / Max Planck POSTECH/KOREA Res. Init. 대한민국,,"Experience in computer programming using C/C++ or FORTRAN, Python, Mathematica or Matlab, specially in parallelized schemes..."
https://kr.indeed.com/viewjob?jk=01b7f9d31e668163,Window Desktop Application Developer (C# / .NET),Bepro Company 서울,"연봉 40,000,000원 - 80,000,000원",참고 - React JS (Web) / Kotlin (Android) / Swift (iOS) - Python + Django - AWS lambda + API gateway - MySQL - Google Cloud...
https://kr.indeed.com/viewjob?jk=9b03fb4dca96750c,2분기 개발자,이스트게임즈 서울 서초구,,"Objective C, Kotlin, Java, JavaScript, Python, Go. - 새로운 프로그래밍 언어를 습득하는데 어려움이 없거나... C|인터넷·IT·통신·모바일·게임>응용프로그래머> Python"
https://kr.indeed.com/viewjob?jk=6b86ea39985912b6,TOAST Cloud 사업기획/영업,NHN 4.4 성남 판교역,,"Linux, Microsoft Solutions 등) - 2년 이상의 개발 경험 (Java, Python 등) - 기술 문서 작성 및 가이드 경험이 풍부한 자 - 대외 고객 기술 지원 경험 공통지원자격..."
https://kr.indeed.com/viewjob?jk=db55ee61f98e6816,DGIST 동반진단의료기술융합연구실 계약직 연구원 채용 공고,대구경북과학기술원 대구 현풍면,,데이터 통계 분석 AI 기반 데이터 분석을 위한 대용량 고속 데이터 처리 DB 구축 우대 사항 Python/Jave 기반 생체 정보 데이터 분석 경험자 대용량 고속 데이터 처리 DB 구축 경험자 급여수준...
https://kr.indeed.com/viewjob?jk=9fa9d498506f86aa,기술영업(신입/경력),에이치알 코리아 대한민국,,"모집부문 기술영업(신입/경력) 업무내용 - 담당업무 : 기술영업 -> 국내 기술영업 지원자격 - 자격요건 영어 구사 가능자( 토익 750점 이상 또는 준하는 역량) - 우대사항 - 프로그래밍 언어 사용가능자(C, VB, Python)"
https://kr.indeed.com/viewjob?jk=05439002712f8135,차세대 광-무선 가입자망 연구센터 연구전담교수,광주과학기술원 광주 북구,,"분야 PCB Layout 및 제작 분야 -생체신호 관련 신호 분석 및 처리 실무 경험자 MATLAB, Python 등을 이용한 뇌신호 처리 및 분석 가능자 박사학위 소지자 우대사항 ① 국가보훈대상자(취업보호대상자..."
https://kr.indeed.com/viewjob?jk=65da831cb9d5a6b5,DGIST 계약직 연구원 및 일반직원 초빙 공고,대구경북과학기술원 대구 현풍면,,"구축 및 생물학 데이터 분석 Tool 개발 및 유지 다양한 프로그래밍(Java, Perl, C++, Python) 우대 사항 관련 분야 석사학위 소지자 유전체, 단백체, 대사체 데이터 분석 유경험자(3년 이상..."
https://kr.indeed.com/viewjob?jk=5054923f264e5eb3,DGIST 동반진단의료기술융합연구실 계약직 연구원 공개 초빙 공고,대구경북과학기술원 대구 현풍면,,"경험자 Matlab 또는 Python 활용 능력 우수자 C/C++... Java, Visual Basic, Python 등) 공학용 프로그래밍 활용 가능자(Matlab, Python 등) 자동차 관련 실험 연구..."
https://kr.indeed.com/viewjob?jk=a8b322f38b3412c5,Senior System Engineer,레이니스트 서울,,"AWS, GCP, Azure, etc) ShellScript, Python, golang 등의 스크립트 언어 가능자 대용량 트래픽과 분산 아키텍처... C++, Java, Shell, Python, Perl, Go 등과 같은..."
https://kr.indeed.com/viewjob?jk=8fb38ec21565c5ae,VDI플랫폼/IaaS 기술 개발 분야 경력사원,에스케이브로드밴드 서울 중구,,"원버튼을 클릭 하시면 기업 홈페이지로 이동 합니다. 전형절차 및 제출서류 전형절차 직무/산업 직무별(직종) 웹프로그래머JAVA, Python 응용프로그래머전산전공, Linux, C, C++ 산업별(업종) 통신사.네트워크 통신"
