Link,Title,Location,Salary,Summary
https://kr.indeed.com/viewjob?jk=03afc264de494fa3,[S/W] AI Platform Engineer,현대자동차그룹 4.4 대한민국,,"ETL) 경험 보유자 - Kubernetes, Docker 등 컨테이너 기반 플랫폼 개발 경험 보유자 - Python, Go, Java, C++ 등 다양한 언어에 대한 개발 역량 보유자 - 음성 관련 서비스 백엔드 개발 경험..."
https://kr.indeed.com/viewjob?jk=d67619b2f9558d16,빅데이터 플랫폼 운영 (HBase엔지니어),LINE Plus corporation 성남 서현역,,동화 - 오픈소스 분석 및 빌드 [자격요건] - 2년이상의 HBase 또는 Hadoop클러스터 운영 경험 - Python 프로그래밍 가능자 - Java 프로그래밍 가능자 [우대사항] - Java 언어에 능숙한 자...
https://kr.indeed.com/viewjob?jk=856b50a536c3e74d,소프트웨어개발 신입/경력 계약직,아이앤아이소프트 성남 분당구,"연봉 35,000,000원 - 40,000,000원",인터넷·IT·통신·모바일·게임>응용프로그래머>Android|인터넷·IT·통신·모바일·게임>응용프로그래머>iOS|인터넷·IT·통신·모바일·게임>응용프로그래머> Python|인터넷·IT·통신·모바일·게임>응용프로그래머>C·C++
https://kr.indeed.com/viewjob?jk=97ec7061b7de4c5a,2016년도 국립기상과학원 1분기 연구원(기간제근로자),기상청 대한민국,,"이상 (졸업예정자 포함) 우대조건 - 서버 운영(유닉스, 리눅스), 프로그램 언어(C, Java, 또는 python 등) 유경험자 우대 2. 근무조건 계약기간 : 계약체결일 ~ 2016. 12. 31. (업무성과에 따라..."
https://kr.indeed.com/viewjob?jk=2c59ef1039e3e5bb,기간제 근로자,기상청 대한민국,,"다음 분야에 대한 학사학위 이상 · 대기과학, 통계학, 지리학, 지구과학 또는 유사분야 - NCL, Python, Fortran 유경험자 기상청 본청 (서울) 1명 2. 근무조건 등 가. 신 분 : 공무원의 사무를..."
https://kr.indeed.com/viewjob?jk=c78a3c5d7bb7d883,웹 애플리케이션 개발자,Nexon 성남 분당구,,"사용 경험 - Maven, Jenkins, Git, SVN Restful API 설계 및 개발 경험 Python 및 Script 언어 중급 이상 비동기 및 병렬처리 프로그래밍 경험 원할한 커뮤니케이션 능력 우대사항..."
https://kr.indeed.com/viewjob?jk=e36af236652e8e9d,Business Analyst (CRM),Coupang 3.1 서울,,"sets Experience using a programming language (R, SAS, Python, Java, etc... automation, job scheduling, and statistical..."
https://kr.indeed.com/viewjob?jk=b574f1454ae36aab,Cross Border Ecommerce - Business Intell...,Shopee 서울,,business analyst related roles Proficient in SQL and Python Strong analytical skill and sensitivity to data Strong oral...
https://kr.indeed.com/viewjob?jk=b4bd6d5bad3b761c,사내 시스템 (O365) 구축/관리 엔지니어,Nexon 성남 분당구,,"가상화 플랫폼 구축/운영 경험자 - Windows 환경 운영에 따른 스크립트 경험자(Powershell, python 등) - 다양한 오픈소스를 활용하여 인프라 구축/운영 경험자 우대사항 - 사내 유관부서와 원활한 커뮤..."
https://kr.indeed.com/viewjob?jk=2eed854308f20975,인공지능 AI 코딩 전문가 양성과정 (무료/취업),송원대학교산학협력단 광주 서구,,게임>빅데이터·AI(인공지능)> Python|인터넷·IT·통신·모바일·게임... 로그래머>머신러닝(ML)|인터넷·IT·통신·모바일·게임>응용프로그래머> Python|인터넷·IT·통신·모바일·게임>응용프로그래머>증강현실(AR)|인터넷...
https://kr.indeed.com/viewjob?jk=df21e3bb5d773616,Python Programmer,Mofac 서울 서초구,,개발 – JAVA 프로그래밍(라이브러리 활용) – Spring 프레임 워크 개발 – Python API 프로그래밍 우대사항 – Python 개발 경험 – Open Source 라이브러리 개발경험 – Web 표준에 대한 경험...
https://kr.indeed.com/viewjob?jk=9a9e91ae6092ed2d,Developers,Coinplug 경기도 성남,,"development and operation Experience using Java / Node.js / Go / Python, etc. Ability to utilize Databases including RDB..."
https://kr.indeed.com/viewjob?jk=c1037225077ca4da,데이터 분석가 (Business Intelligence Analyst),코스닥 상장 중견 게임기업 서울 강남구,"연봉 40,000,000원 - 70,000,000원","데이터 분석 결과를 쉽게 이해할 수 있도록 간결하고 명확한 의사전달 능력 [우대조건] * R, Python, Spark 등의 언어에 대한 이해도 * 모바일 앱SDK 연동 지원 업무 경험(Facebook, Admob..."
https://kr.indeed.com/viewjob?jk=faf0422473d4188a,[Search] 쇼핑검색 AI 기술 개발 신입/경력사원,네이버 대한민국,,"design / Large-scale data processing [자격요건 및 우대사항] · C, Java, Python, Scala 등 하나 이상의 언어에 능숙 하신 분 · 위 채용분야 관련 2 년 이상 실무 경험 또는..."
https://kr.indeed.com/viewjob?jk=28cde36427979564,PC플랫폼 운영을 담당할 를 합니다.,Nexon 성남 분당구,,"Powershell, VBS, Python 등을 이용한 시스템 자동화... 있는 경우 우대하여 평가한다. -개발경력 보유 :JAVA/C/C++/ Python/VBS 등을 이용해 개발 및 분석이 가능한 분 -영어회화 가능자..."
https://kr.indeed.com/viewjob?jk=4e17fe419583b40b,데이터 분석 및 모델링 (페이코 쿠폰/광고 타겟팅),NHN 4.4 성남 판교역,,"구축, 피쳐 발굴, 모델 튜닝, 결과 해석 등) - 머신 러닝 및 데이터 분석 관련 언어 (R, Python,SQL 등) 능숙한 활용 - 리눅스 환경에서 개발 가능 - 통계, 머신 러닝 등 관련 분야 (통계..."
https://kr.indeed.com/viewjob?jk=2b7bc67cebf49cc0,"빅데이터, 인공지능(AI) 외 신입/경력 정규직",thecompany 경상남도,,모바일·게임>빅데이터·AI(인공지능)>인공지능(AI)|인터넷·IT·통신·모바일·게임>빅데이터·AI(인공지능)> Python|인터넷·IT·통신·모바일·게임>빅데이터·AI(인공지능)>머신러닝|인터넷·IT·통신·모바일·게임>빅데이터...
https://kr.indeed.com/viewjob?jk=5bc622575fee61b8,Data Scientist,하이퍼커넥트 서울,,"가이드 자격요건 최소 2년 이상의 데이터 과학 및 분석 실무 경력 능숙한 SQL 구현 역량 및 실무 경험 Python 또는 R 분석 코드 구현 역량 및 실무 경험 머신러닝에 대한 기본 이해 우대사항 개인화, 최적화 등..."
https://kr.indeed.com/viewjob?jk=cbad561994e47d94,[KSTEC] RPA 시스템 개발 경력사원,지식시스템 성남 분당구,,통신·모바일·게임>웹프로그래머>JAVA|인터넷·IT·통신·모바일·게임>웹프로그래머>.NET|인터넷·IT·통신·모바일·게임>웹프로그래머> Python|인터넷·IT·통신·모바일·게임>웹프로그래머>HTML·DHTML·mHTML
https://kr.indeed.com/viewjob?jk=b83e48f219011128,매칭팀 - 프로그래머,Nexon 성남 분당구,,"상의 서비스 개발과 운영 - 게임 매치메이킹, 추천 시스템 개발 지원자격 - 한 가지 이상의 개발 언어( Python, C++, C#, Go 등)에 숙련된 프로그래밍 능력 우대사항 - 게임 개발 또는 라이브 서비스 경험이..."
https://kr.indeed.com/viewjob?jk=bd47be8c217b1a6e,PDC SW Engineer (R&D Extension),Applied Materials Inc. 경기도 화성,,"engineer with C, C++, C#, Java, MATLAB, SQL data base, Python, Excel Macro Qualifications Education: Bachelor's Degree..."
https://kr.indeed.com/viewjob?jk=e11bc11a4d72cc54,MPK / MPI-SD Joint Postdoctoral Position for Ultrafast Nonli...,POSTECH / Max Planck POSTECH/KOREA Res. Init. 대한민국,,"Experience in computer programming using C/C++ or FORTRAN, Python, Mathematica or Matlab, specially in parallelized schemes..."
https://kr.indeed.com/viewjob?jk=4fbc49b63296ff88,Data Engineer (Analytics/Anomaly-detecti...,LINE Plus corporation 성남 서현역,,"및 추출이 능숙한 자 - VCS(Git) 기반으로 협업하는 것이 익숙한 자 - 데이터 분석 및 추출을 위한 Python, Scala 언어를 사용할 줄 아는 자 [우대사항] - Hadoop 기반 분석 환경(Spark..."
https://kr.indeed.com/viewjob?jk=2d1e42c180f4f791,[기술기획] 클라우드 플랫폼 개발자,한국카카오은행 성남 분당구,,"수 있는 분 · Golang, Python, Javascript 중 하나... 게임>응용프로그래머>클라우드|인터넷·IT·통신·모바일·게임>응용프로그래머> Python|인터넷·IT·통신·모바일·게임>응용프로그래머>자바스크립트|인터넷..."
https://kr.indeed.com/viewjob?jk=e9e86127df39c006,[Search] 검색 서버 개발 & DevOps 엔지니어 신입/경력사원,네이버 대한민국,,"Linux 환경에서의 개발 경험이 있으신 분 · C++, Go, Python 등 하나 이상의 프로그래밍 언어로 서버 개발이 가능하신 분 · 컨테이... 으신 분 · C++, Go, Python 등 프로그래밍 언어에 하나 이상..."
https://kr.indeed.com/viewjob?jk=6a399a2c059ebbb1,System Engineer (South Korea),Confluent 서울,,Computer Science or relevant experience Proficiency in Java or Python with experience developing ETL applications What gives...
https://kr.indeed.com/viewjob?jk=61ecdc0ef3cfb66a,[경력] 빅데이터 플랫폼 엔지니어,카카오 4.2 성남 판교역,,"미만 <기술> 전산 전공 또는 그에 준하는 실무 경험을 갖추신 분 Java 필수, 그 외 Scala, Python, Ruby 중 1개 이상 언어로 개발 가능하신 분 하둡 플랫폼에 대한 기본 지식을 갖추신 분 하둡 클러스터..."
https://kr.indeed.com/viewjob?jk=3c63bba3ee9b3090,"Tech U Associate Solution Architect, Pub...",Amazon Web Services Korea LLC 서울,,"languages: Java, Python, Ruby, Node.js... programming (Node.JS, Java, Ruby, C#, Python, or PHP) · Demonstrated ability..."
https://kr.indeed.com/viewjob?jk=bd7e666e67507d66,금융그룹사 AI 자연어처리 부문 인공지능 서비스 연구개발,금융그룹사 NLP / Text Mining 연구원 석사 이상 서울,,"산업공학 관련 전공 • 자연어처리/텍스트마이닝/머신러닝/딥러닝 모델 연구개발 경력자 • 프로그래밍( Python, C/C++, Java 등) 가능자 우대사항... NLP 관련 딥러닝 지식 및 활용 경험..."
https://kr.indeed.com/viewjob?jk=2615f45e6f912c05,"Customer Solutions Engineer, Global Clie...",Google 4.3 서울,,"general purpose programming language (e.g., Java, C/C++, Python). Preferred qualifications: Experience... online..."
https://kr.indeed.com/viewjob?jk=0bbf23c0930be392,Support Engineer,Microsoft 4.2 서울,,"Linux script-based development environments and tools (PERL, Python, Ruby, PhP, etc.) Programming language (C++/C#) Please..."
https://kr.indeed.com/viewjob?jk=711b922289384d7f,금융플랫폼 AI 플랫폼 연구개발,금융그룹 AI 플랫폼 연구개발 서울,,격요건 * - 석사학위 이상 보유자 (박사 우대) - 관련 경력 2년 이상 * 필수조건... Python / Scala / Java / JavaScript / TypeScript 중급 이상 (택1) - Data...
https://kr.indeed.com/viewjob?jk=701b04f0ab18c3d0,Software Engineer - Real-time Chat Platf...,Sendbird 서울,,"knowledge of Python or Java 2+ years... Unix/Linux systems Understanding of Python, Java, and Event-Driven Frameworks..."
https://kr.indeed.com/viewjob?jk=07f425a9fb3ee67b,"글로벌 플랫폼 쉴드 개발(인증보안,이상결제,평판 등)",Nexon 성남 분당구,,"청제한시스템 - 평판시스템 지원자격 - 전체 개발 경력 3~8년 - Python , GO 개발 경력 우대 (팀 내부 주 개발 언어가 Python, Go 입니다.) - 비동기, 병렬처리 프로그래밍 기술 - OS, DB..."
https://kr.indeed.com/viewjob?jk=f8fceff441e23ad6,인프라보안 직군 모집,넷마블 서울 구로구,,"스크립트(Batch, Python, Shell, Powershell 등... 분석 경험 있으신 분 - 웹/ 시스템 해킹 관련 지식 보유하신 분 - Python, Perl, Bash Script 사용 가능하신 분 클라우드 보안..."
https://kr.indeed.com/viewjob?jk=257986b1208d3042,외국계 IT장비지원하는 분,퀀텀솔루션 성남 분당구,"연봉 25,000,000원 - 40,000,000원","(주)퀀텀솔루션 JAVA, Python 외 경력 정규직 채용 모집부문 및... 통신·모바일·게임>응용프로그래머>JAVA|인터넷·IT·통신·모바일·게임>응용프로그래머> Python|인터넷·IT·통신·모바일·게임>웹프로그래머>PHP"
https://kr.indeed.com/viewjob?jk=530a598184580c95,데스크탑 가상화(VDI) 엔지니어,카카오 4.2 성남 판교역,,"기본적 이해 리눅스 시스템에 대한 기본적 이해 우대사항 시스템 엔지니어 경력자 Powershell, Python, Shell 스크립트를 이용한 인프라 관리 자동화 경험자 부드러운 커뮤니케이션, 친절한 마인드의 소유자..."
https://kr.indeed.com/viewjob?jk=4972bb33a0811170,2014년도 국립기상연구소 상반기 연구원(기간제근로자),기상청 대한민국,,운영 및 개선 전산 관련 분야 학사 학위 이상 리눅스 사용 및 쉘 프로그래밍 필수 * 우대조건: Python 경험자 해양연구(F) 0명 전지구 해양순환 예측시스템 개발 해양-대기 상호작용 연구 지역 해양순환...
https://kr.indeed.com/viewjob?jk=90104004fabe2502,[Search] 글로벌 콘텐츠 검색/ AI 기술 개발 신입/경력사원,네이버 대한민국,,"대규모 로그 분석 및 관련 시스템 운영 · 콘텐츠 검색 서비스 개발 및 운영 필요역량 · C, Java, Python 등의 프로그래밍 언어 중 1 개 이상 자유자재로 다루시는 분 · Linux/Shell 및 Git 환경에..."
https://kr.indeed.com/viewjob?jk=f5f5f902d240ac96,Data Scientist,토스 서울 강남구,,"학위 또는 실무 경험 5년 이상 갖춘 분 실제 서비스 데이터를 이용한 분석모델 개발 경험이 있는 분 R, Python, Scala, SQL 등 데이터 분석의 업무를 수행할 수 있는 하나 이상의 개발 언어에 능숙한 분 우대..."
https://kr.indeed.com/viewjob?jk=71e0b966bf1531df,검색개발,NHN 4.4 성남 판교역,,리눅스 환경 개발 경력 2년 이상 - 딥러닝 모델 분석 유경험자 - Python 개발 유경험자 - 딥러닝 모델 개발 유경험자 - Python 실무 유경험자 공통지원자격 - 병역필 혹은 면제로 해외여행에 결격 사유가...
https://kr.indeed.com/viewjob?jk=8bbea4b70a2422ae,2018년도 국가기상위성센터 공무직근로자(연구원) (전문연구요원 포함),기상청 대한민국,,"개발 유경험자 ㅇ 프로그램 개발이 가능한 자(Fortran, C, Python, shell 등) 채용분야 채용 예정 직급 선발예정 인원... 가능한 자(Fortran, C, Python, shell 등) 2. 근무..."
https://kr.indeed.com/viewjob?jk=dd4d8e59a4a9265d,Data Specialist (Scientist&&Engineer),아우름플래닛 서울 마포구,,"Tensorflow, Keras, Pytorch, Theano 등)를 하나 이상 사용할 수 있는 분 • R, Python, Scala, SQL 등을 이용한 데이터 분석 및 프로그램 개발 능력이 있는 분 • 데이터 분석 기법..."
https://kr.indeed.com/viewjob?jk=41818bc2a8ab8283,WebRTC UC & Collaboration Developer,Ericsson 서울,,"experience: Linux, JavaScript, Node.js, React.js, Docker, Python, WebRTC Media, Low-level Media API, RESTful Understanding..."
https://kr.indeed.com/viewjob?jk=e5098c47e3662580,BI 운영 그룹 주력계열사,그룹 주력계열사 서울특별시,,"운영 및 관리 - SQL, JAVA script, BW, Spotfire, Python, DB (Oracle, Green Plum, Hadoop 등... 개념 및 관련 Language( Python, SQL, JAVA script..."
https://kr.indeed.com/viewjob?jk=79aa0ecba6067f06,[Clova] Clova Platform Backend 개발자 경력사원,네이버 대한민국,,자격요건] - 백엔드 서비스 개발 경험 3 년 이상 또는 그에 준하는 역량을 가진 분 - Go/Java/ Python/C++ 중 1 개 이상의 프로그래밍 언어에 익숙하신 분 - 웹 / 모바일 서비스의 일반적인 아키텍쳐 이해...
https://kr.indeed.com/viewjob?jk=bab439fda7a47f48,2015년도 하반기 국립기상과학원 연구원(기간제근로자) (마감: 2015...,기상청 대한민국,,"ESGF 노드 운영 학사 이상 대기과학 또는 전산관련 학과 우대 유닉스, 리눅스, C, Java, python 등 유경험자 우대 국가공무원법 제33조 각 호의 결격사유가 없는 자(남자는 병역 필한 자) (최종합격..."
https://kr.indeed.com/viewjob?jk=36b2d95ca4db80f4,Machine Learning Researcher - Speech Syn...,Qualcomm 4.1 서울,,"Representation learning of audio/speech signal - Generative models (VAE, GAN, normalizing flow) - Fluency in Python and C/C++"
https://kr.indeed.com/viewjob?jk=65232d6e37b8f7fb,주니어 데이터 엔지니어 / Junior Data Engineer,Bagelcode 서울,,일관성을 보장할 수 있는 시스템 연구 및 개발 [업무 내용] - Python과 Airflow를 이용한 데이터 파이프라인 개발 - Spark와... 본적인 전산 지식에 대한 이해 - Python / Java / Scala...
https://kr.indeed.com/viewjob?jk=a5405c883e10ded4,APEC 기후센터 직원,기상청 대한민국,,중심의 프로그래밍 개발 경력자 우대) 자료처리 및 분석을 위한 R 및 Python 등 프로그래밍 가능 기초 공간분석 (GIS data analysis... 소지자 통계 분석을 위한 R 및 Python 등 프로그래밍 (필수) 빅데이...
https://kr.indeed.com/viewjob?jk=57cf3c5db3b822fc,자동차 전장부품 모션제어 경력인재- 자동차부품 우량대기업,에스에프인촌 서울 강남구,,C++ / Javascript / Python 경험자 - EtherCAT... 로그래머>자바스크립트|인터넷·IT·통신·모바일·게임>응용프로그래머> Python|인터넷·IT·통신·모바일·게임>응용프로그래머>클라우드|인터넷·IT·통신...
https://kr.indeed.com/viewjob?jk=e75ddeeb278d91f2,Principal Business Analysis (CRM),Coupang 3.1 서울,,"sets Experience using a programming language (R, SAS, Python, Java, etc... automation, job scheduling, and statistical..."
https://kr.indeed.com/viewjob?jk=952e0a8d9bac4aea,고성능 게임 피드백 서버 개발,Nexon 성남 분당구,,"및 ML 알고리즘을 실행 하는 서버 개발 지원자격 - (필수) 한 가지 이상의 개발 언어(C++, C#, Python 등)에 숙련된 프로그래밍 능력 - RESTful API 및 TCP/UDP 서버 개발 경험 및 네트워크와..."
https://kr.indeed.com/viewjob?jk=e11bc11a4d72cc54,MPK / MPI-SD Joint Postdoctoral Position for Ultrafast Nonli...,POSTECH / Max Planck POSTECH/KOREA Res. Init. 대한민국,,"Experience in computer programming using C/C++ or FORTRAN, Python, Mathematica or Matlab, specially in parallelized schemes..."
https://kr.indeed.com/viewjob?jk=7268328c0d71d81c,Junior Full-Stack Developer,Asiance 서울,,"React 혹은 WordPress 등의 CMS도 사용. • Python, Node.js, Java, PHP for backend development. • Python, Node.js, Java, PHP 등을 사용하여 백엔드..."
https://kr.indeed.com/viewjob?jk=ba14be82795fd2e6,(클라우드서비스) 언더클라우드 서버 개발자 모집,카카오엔터프라이즈 성남 삼평동,,"래밍 언어에 능숙하신 분 - Linux 또는 Cluster 에 대한 이해 (우대사항) - Golang, Python 중 한가지 언어에 능숙한 개발자 - Openstack 혹은 Kubernetes를 이용한 개발 및 운영..."
https://kr.indeed.com/viewjob?jk=d04fc2b73edbc742,데이터분석가(팀장급),리디 서울,,"대한 이해 및 활용 가능 데이터에 기반한 사고 능력 비즈니스 데이터 분석 실무 경험 데이터 처리 언어 (R, Python, Scala) 사용 경험 추가 정보 우대 사항 데이터 분석팀 리딩 경험 리디 서비스 사용 경험 통계..."
https://kr.indeed.com/viewjob?jk=a03fdcac1dffb97a,데이터 분석가(팀원급),리디 서울,,"이해 및 활용 가능 데이터에 기반한 사고 능력 비즈니스 데이터 분석 실무 경험 데이터 처리 언어 (R, Python, Scala) 사용 경험 추가 정보 우대 사항 리디 서비스 사용 경험 통계 모델링 또는 머신러닝 경험..."
https://kr.indeed.com/viewjob?jk=e393fa440b668be7,Data Analyst,토스 서울 강남구,,"박사 학위 소지하신 분 혹은 경험이 풍부하신 분 Data Warehouse 구축 지식이나 경험이 있으신 분 Python, R, Spark 등 언어 및 데이터 프로세싱 프레임워크에 대한 이해도가 높은 분 필요한 데이터를 스스로..."
https://kr.indeed.com/viewjob?jk=29fe737d11034db3,(주)웨이브웨어 2020 년도 신입사원 (개발자),웨이브웨어 대전 유성구,"연봉 25,000,000원 - 30,000,000원","유경험자 - keras/theano/tensorflow 유경험자 - python, java 유경험자 - lwjgl/jogl 을 이용한 OpenGL... tensorflow 유경험자 - python, java 유경험자..."
https://kr.indeed.com/viewjob?jk=68ee194a9d487aac,Data Engineer,고도소프트 서울 구로구,,"MongoDB, CouchBase, Hadoop, Redis 등 운영 경험이 있는 분 - PHP, Python, JAVA, GO 중 1개 이상 사용한 개발이 가능한 분 우대사항 - Spark, ELK, R, MapReduce..."
https://kr.indeed.com/viewjob?jk=2f64e12e457da027,동대문구 국비 무료 훈련생,동대문여성인력개발센터 서울 동대문구,,통신·모바일·게임>빅데이터·AI(인공지능)>데이터분석|인터넷·IT·통신·모바일·게임>빅데이터·AI(인공지능)> Python|인터넷·IT·통신·모바일·게임>빅데이터·AI(인공지능)>머신러닝|인터넷·IT·통신·모바일·게임>빅데이터...
https://kr.indeed.com/viewjob?jk=cef60a5a4a42fe95,AD Performance Dev,LINE Plus corporation 성남 서현역,,"Java, Scala 중 2개 이상의 개발 언어에 능숙한 자 - 위 언어중 1개에 익숙하고 R 또는 Python 기반으로 분석에 능숙한 자 아래 요건 중 최소 한 가지 해당 - 대용량 트래픽 서버를 개발 및 운영한..."
https://kr.indeed.com/viewjob?jk=01b7f9d31e668163,Window Desktop Application Developer (C# / .NET),Bepro Company 서울,"연봉 40,000,000원 - 80,000,000원",참고 - React JS (Web) / Kotlin (Android) / Swift (iOS) - Python + Django - AWS lambda + API gateway - MySQL - Google Cloud...
https://kr.indeed.com/viewjob?jk=deb23c0881100256,FDS 서버 개발,LINE Plus corporation 성남 판교역,,"visualize [자격요건] - 실시간 데이터 처리, pipeline 개발 경험 - java, python 중 하나 이상 언어에 익숙한 자 - Kafka Producer, Consumer 개발 경험 - 시스템 장애..."
https://kr.indeed.com/viewjob?jk=b9974ad79659bb6d,"카카오콘 앱(iOS), 서버 경력 개발자",카카오 4.2 대한민국,,"2년 이상 모바일 환경을 위한 API 시스템 개발 경험 특정 언어 하나에 능숙하신 분으로, 배워서라도 Python 또는 Ruby 개발이 가능하신 분 [우대사항] 백엔드 서버와 웹 프런트엔드 모두 개발 가능하신 분 ※ 카카오..."
https://kr.indeed.com/viewjob?jk=b7be58e7af38d186,Developer (개발자),Coinplug 경기도 성남,,"Azure 등 Cloud 환경에서 빌드, 배포, 모니터링 등의 경험이 있으신 분 서버 개발 [우대사항] Python / Node.js / Go / Java 중 한 가지 이상의 개발 언어에 익숙하신 분 Restful API..."
https://kr.indeed.com/viewjob?jk=5931380bf0919d90,제2020-1회 수리 및 계산 과학 연구단 데이터사이언스그룹 연구직,기초과학연구원 대전,,우수 국제 컨퍼런스 혹은 국제저널 논문 게재자 · 분석언어와 도구를 하나 이상 능숙하게 다룰 수 있는 자( Python/R/Scala/Scikit-learn/Spark/TensorFlow/PyTorch) · 로그 수준의 데이터...
https://kr.indeed.com/viewjob?jk=d760522e2b9e8e15,2016년도 상반기 국립기상과학원 기간제근로자(소프트웨어기사),기상청 대한민국,,"고사항 - 석사 이상, 기후모델자료 처리 유경험자 우대 - 유닉스 또는 리눅스 서버운영, C, Java, 또는 python 등 유경험자 우대 - 국가기상슈퍼컴센터 관사 이용 가능 - 자격 및 경력에 따른 보수 조정 가능 2..."
https://kr.indeed.com/viewjob?jk=978edf4ea4db4d6c,Senior Full-stack Developer,Asiance 서울,,"React 혹은 WordPress 등의 CMS도 사용. • Python, Node.js, Java, PHP for backend development. • Python, Node.js, Java, PHP 등을 사용하여 백엔드..."
https://kr.indeed.com/viewjob?jk=b245cdab72782813,커머스 플랫폼 개발 (데이터 엔지니어),LINE Plus corporation 성남 서현역,,에게 인사이트를 전파 - 데이터 분석 업무의 효율화를 위한 데이터 가공/추출 관련 개발 [자격요건] - Python 언어를 활용하여 Tensorflow Framework 기반 개발이 가능한 분 - 기본적인 ML 개념을...
https://kr.indeed.com/viewjob?jk=481f953ccaa4bc96,AI 연구/개발 직군 모집,넷마블 서울 구로구,,"ML 관련 분야 경력 6년 이상 - Cloud 서비스 활용 경험 - Python, C/C++, SQL 사용 가능 - Tensorflow 또는 상응하는... 웹 서비스 구축 등 자격요건 - Python 에 능숙하고 C/C++ 혹은..."
https://kr.indeed.com/viewjob?jk=7c7f6f9c070d78bd,Robot SW Engineer 그룹 IT인프라 구축,그룹 IT인프라 구축 서울특별시,,"대한 기본 이해(Git 등)"" Skill - Robot Application 개발 기술: C#, C++, Python, ROS, Linux 등 - Machine Learning 적용 알고리즘 구현 및 운영 - Vision..."
https://kr.indeed.com/viewjob?jk=6219c67701d6d524,[해외취업] Senior Back-End Developer,LILI SG 대한민국,"연봉 60,000,000원 - 100,000,000원",있으셔야 합니다. 면접자에게는 구체적으로 어떤 작업들이 더 필요한지 정보를 공유해 드리도록 하겠습니다. Python을 조금 더 선호하지만 프로그래밍 언어는 지원자의 숙련도와 실력에 따라 자율성을 드릴 생각입니다. Front...
https://kr.indeed.com/viewjob?jk=a50fce6cc2cb57c9,자연어처리전문가 금융챗봇 만들어 갈 엔지니어,파운트 서울 충정로역,,리에 필요한 알고리즘을 개발하고 Python으로 구현 및 성능 검증을 진행... Description - 자연어 처리에 필요한 알고리즘을 개발하고 Python으로 구현 및 성능 검증을 진행 - 자연어 전처리 (형태소 분석...
