Link,Title,Location,Salary,Summary
https://kr.indeed.com/viewjob?jk=a50fce6cc2cb57c9,자연어처리전문가 금융챗봇 만들어 갈 엔지니어,파운트 서울 충정로역,,리에 필요한 알고리즘을 개발하고 Python으로 구현 및 성능 검증을 진행... Description - 자연어 처리에 필요한 알고리즘을 개발하고 Python으로 구현 및 성능 검증을 진행 - 자연어 전처리 (형태소 분석...
https://kr.indeed.com/viewjob?jk=af4eba857169ba01,[한국오라클] Data Center Technician (Engineer...,한국오라클 3.3 강원도 춘천,,"Base Operating System Install • Some experience with Perl, Python, Bash or Java • Core OS Services: ssh, telnet, ftp, nfs..."
https://kr.indeed.com/viewjob?jk=7af1798e214d4067,Support Engineer _ Devices & IoT,Microsoft 4.2 서울,,"problem-solving skills • Strong C/C++ coding skills, along with Python, C# and Java • Azure/AWS cloud development experience..."
https://kr.indeed.com/viewjob?jk=fd0e5f5aa2592df1,[해외취업] IT엔지니어,유아솔류션즈 대한민국,"연봉 21,000,000원 - 22,000,000원","Swift iOS/Android 스마폰 소프트웨어 개발, WEB 서비스 개발, 업무 소프트웨어 개발. ・ Python/Perl AI,시뮬레이션 및 빅크 데이터분석 Tool구사와 개발 통신/운통 운영시스테므 개발 ・C/C++..."
https://kr.indeed.com/viewjob?jk=36a2af333271978e,"(주)트윔 개발자(경력직) 빅데이터,영상처리,머신비전/AI 딥러닝",트윔 경기도 화성,,"자기주도적으로 진행한 경험 - Python/C/C++ 능통자 - 데이터... RNN 등 딥러닝 이론 및 알고리즘 유경험자 - C/C++, Java, Python/TensorFlow/Caffe 사용가능자 - Matlab/R 분석..."
https://kr.indeed.com/viewjob?jk=c1936b77c8be4bcf,빅데이터 플랫폼 및 BI시스템 구축 그룹 IT계열사,그룹 IT계열사 서울특별시,,"Machine Learning(ML) 기본 개념 및 관련 Language( Python) - DB (Oracle, Green Plum, Hadoop 등... 통계분석 방법론 및 분석 tool (R, Python) 경험자 우대"
https://kr.indeed.com/viewjob?jk=68875cf86f31569e,ERP 담당자 모집,넷마블 서울 구로구,,"기반 ERP Web Portal 시스템개발/운영 경력 3~9년 보유자 - Spring (혹은 .NET, Python 등) 프로그래밍 가능자 - 시스템 분석/설계 가능자 - 재무/회계 기본 지식 보유자 우대사항 - IT 프로젝..."
https://kr.indeed.com/viewjob?jk=05afd9bcc59da43a,"[NIT Service] NAVER, LINE 서비스 플랫폼 운영",엔아이티서비스 성남 분당구,,"엔아이티서비스 주식회사 [NIT Service] NAVER, LINE 서비스 플랫폼 운영 네이버/라인 서비스 플랫폼운영이란, 국내 및 해외를 포함하여 글로벌하게 제공되는 네이버/라인 서비스인 V앱, 파파고, 네이버클라우드플랫..."
https://kr.indeed.com/viewjob?jk=385c58c7ced1d77b,데이터 사이언티스트 지향하는 데이터 엔지니어,카카오 4.2 성남 판교역,,"Spark 등 빅데이터 분석 플랫폼을 사용하여 대용량 데이터의 수집,가공이 가능한 분 프로그램 개발(Java, python 등) 기술을 보유하신 분 직무 관련 경력 2년 이상 어떤 일이라도 중요하게 여기며 책임감 있게 진행할..."
https://kr.indeed.com/viewjob?jk=1c4f1c0b625f5abd,데이터 분석 직군 모집,넷마블 서울 구로구,,"정형/비정형 데이터 분석 및 모델링 가능 - 통계 분석 도구 (R, Python, Tensorflow 등) 및 SQL 사용 가능 - 다양한 직군의... 자격요건 - Java 또는 Python 개발 경력 3년 이상 - 새로운..."
https://kr.indeed.com/viewjob?jk=19b44e0d17d112e2,분석실 - 베이지안 분석 전문가,Nexon 성남 분당구,,"동으로부터 피드백을 받아 최적화 모델을 개선합니다. - 주요 활용 tool : SQL, zeppelin, python, tableau 지원자격 - (필수) 논리적이고 체계적인 문제 해결 및 커뮤니케이션 능력을 소유하신 분..."
https://kr.indeed.com/viewjob?jk=94064c6864564f7b,CG Artist,LOCUS 대한민국,,"크리쳐 리깅 MAYA 가능자 / PYTHON SCRIPT 가능자 MEL... PHOTOSHOP, AE) DIGITAL PAINTING/ MEL/ PYTHON SCRIPT HAIR/CLOTH 신입/경력 00명 헤어/클로스..."
https://kr.indeed.com/viewjob?jk=56bcae4fcfe15488,연동개발팀 직,NHN Edu 4.4 성남 판교역,,"우대사항 - 범용 웹 크롤러 플랫폼 개발 - 운영 자동화 도구 개발 - 크롤링 관련 데이터 분석 - Python, Ruby 언어 중 1개 이상의 개발 경험 - 배치 소프트웨어 혹은 웹 개발 가능자 - 개발 경험 2..."
https://kr.indeed.com/viewjob?jk=5b8d56d7f11903a2,데이터연동개발팀 - 데이터엔지니어,Nexon 성남 분당구,,구축에 대해 경험이 있으신 분 - SQL 활용 능력이 뛰어나신 분 우대사항 - 경력 3년 이하 - Python이나 Scala 등과 같은 프로그래밍 언어를 활용하여 ETL 개발이 가능하신 분 - Spark를 활용하여...
https://kr.indeed.com/viewjob?jk=d71794dc69947981,소프트웨어 엔지니어,Nexon 성남 분당구,,주요업무 - 넥슨 글로벌 플랫폼의 게임 클라이언트 배포 시스템 및 어플리케이션 개발 지원자격 - C++ 혹은 Python 프로그래밍 언어 능숙자 - 비동기 및 병렬처리 프로그래밍 경험 우대사항 - Modern C++ (11...
https://kr.indeed.com/viewjob?jk=e11bc11a4d72cc54,MPK / MPI-SD Joint Postdoctoral Position for Ultrafast Nonli...,POSTECH / Max Planck POSTECH/KOREA Res. Init. 대한민국,,"Experience in computer programming using C/C++ or FORTRAN, Python, Mathematica or Matlab, specially in parallelized schemes..."
https://kr.indeed.com/viewjob?jk=c193b65defa6a4ec,Web 개발,Success Korea 서울 중구,,"험자 - 가상화, Docker 기술 경험자 - 네트워크 지식 보유자 - Python 개발 경험자 - 인공지능 딥러닝, 빅데이터 관심있는 자 - GIS... 네트워크 지식 보유자 - Python 개발 경험자 - 인공지능 딥러닝..."
https://kr.indeed.com/viewjob?jk=c81984fb6cd9a0c6,빅데이터 전략/마케팅 (과~차장),Success Korea 서울 중구,,"이상 - 전문지식 ※ 통계분석(SAS, R 등) ※ 빅데이터분석 ( Python, Spark, Hadoop, Aster 등) ※ 인공지능, 머신... R 등) ※ 빅데이터분석 ( Python, Spark, Hadoop..."
https://kr.indeed.com/viewjob?jk=6561c937add50cc4,SW 개발,Success Korea 서울 신논현역,,"및 구현 - 빅데이타 플랫폼/ 데이타관리 [자격요건] - JAVA, Python 등 OOP(Object Oriented Programming) 언어... 국문이력서 자격요건 - JAVA, Python 등 OOP(Object..."
https://kr.indeed.com/viewjob?jk=989584aa51f96aa1,SW개발(3명),Success Korea 서울 삼성동,,"++, C # 중 하나의 개발언어 능숙자 - Javascript, Python, PHP, Ruby, Perl, Delphi중 하나도 가능한 분 우대... 능숙자 - Javascript, Python, PHP, Ruby, Perl..."
https://kr.indeed.com/viewjob?jk=89d3bffd37a2487a,빅데이터 플랫폼 운영 및 분석구현,Success Korea 서울,,"데이터 분석, 또는 데이터 엔지니어링 경력 5년 이상 - JAVA, Python, SQL 중 두 개 이상의 개발 언어에 대한 높은 이해 [전형절차... 경력 5년 이상 - JAVA, Python, SQL 중 두 개 이상의 개발..."
https://kr.indeed.com/viewjob?jk=4e0b7f602fa05487,DevOps Developer(Cloud),Success Korea 서울 논현동,,"개발 경험 5년 이상 - .Net, Java, PHP, Node.js, Python, REST API 관련 이해도가 높은 자 - Cloud Web... Java, PHP, Node.js, Python, REST API 관련..."
https://kr.indeed.com/viewjob?jk=220551aa57f5eed8,Technical Artist,Success Korea 서울 강남구,,"책임지는 역할 [자격요건] - Python, MEL 또는 Max script 같은 스크립트 언어 사용 경험 -PHOTOSHOP, MAYA 등의 아트웍툴 사용 [우대사항] -C# 또는 Python 언어에 대한 이해 및 활용..."
https://kr.indeed.com/viewjob?jk=ba3e218f3dfb8be7,Security Developer,Success Korea 서울 삼성동,,"요건] - 보안 취약점 점검 관련 경력 5년이상 - Java, PHP, Python 등의 언어로 프로그램 개발 필수 - IT인프라에 대한 지식 보유자... 년이상 - Java, PHP, Python 등의 언어로 프로그램 개발 필수..."
https://kr.indeed.com/viewjob?jk=5620b1845a6fad85,Microsoft 기술지원(Azure),Success Korea 서울 논현동,,"자격요건] - AWS기반 Serverless 개발 경험자 - Java, Python, Node.js등 백앤드 서버 개발 유 경험자 - System 및... 개발 경험자 - Java, Python, Node.js등 백앤드 서버 개발..."
https://kr.indeed.com/viewjob?jk=01b7f9d31e668163,Window Desktop Application Developer (C# / .NET),Bepro Company 서울,"연봉 40,000,000원 - 80,000,000원",참고 - React JS (Web) / Kotlin (Android) / Swift (iOS) - Python + Django - AWS lambda + API gateway - MySQL - Google Cloud...
https://kr.indeed.com/viewjob?jk=6373005ce9ee17b0,cloud/saas개발,Success Korea 서울,,"발업무 경력 3년이상 -Node.js(java-script), SpringBoot(Java), Django( Python) 실무 경험 1년 이상 (최소 1개 이상) -RDB(Oracle, MySQL, Postgres 1개 이상..."
https://kr.indeed.com/viewjob?jk=806b07d4b07e4c47,SW Architect,Success Korea 서울 신논현역,,"자격요건] - C#, JAVA, Python 등 OOP(Object... 임원면접 [제출서류] 국문이력서 자격요건 - C#, JAVA, Python 등 OOP(Object Oriented Programming) 언어..."
https://kr.indeed.com/viewjob?jk=9301688209a46cd7,전자상거래 플랫폼 인프라 설계/구축/운영,Success Korea 서울,,5년 이상 - bash / Python Script 활용 능력 - 대용량... 국문이력서 자격요건 - 관련 직무 경력 5년 이상 - bash / Python Script 활용 능력 - 대용량 서비스 트래픽 운영 경험 - 오픈...
https://kr.indeed.com/viewjob?jk=c1037225077ca4da,데이터 분석가 (Business Intelligence Analyst),코스닥 상장 중견 게임기업 서울 강남구,"연봉 40,000,000원 - 70,000,000원","데이터 분석 결과를 쉽게 이해할 수 있도록 간결하고 명확한 의사전달 능력 [우대조건] * R, Python, Spark 등의 언어에 대한 이해도 * 모바일 앱SDK 연동 지원 업무 경험(Facebook, Admob..."
https://kr.indeed.com/viewjob?jk=3d594f8990d3a797,Cloud System Engineer,Success Korea 서울,,"보유자 - CI/CD 구축 및 운영 경험자 우대사항 : - e커머스 서비스 운영 경험자 - 스크립팅 가능자 ( Python, Go, Shellscript) - Cloudformation, Ansible, Terraform 등..."
https://kr.indeed.com/viewjob?jk=a758b91ea2f0dd2b,SW개발 매니저,Success Korea 서울 삼성동,,"++, C # 중 하나의 개발언어 능숙자 - Javascript, Python, PHP, Ruby, Perl, Delphi중 하나도 가능한 분 우대... 능숙자 - Javascript, Python, PHP, Ruby, Perl..."
https://kr.indeed.com/viewjob?jk=e11bc11a4d72cc54,MPK / MPI-SD Joint Postdoctoral Position for Ultrafast Nonli...,POSTECH / Max Planck POSTECH/KOREA Res. Init. 대한민국,,"Experience in computer programming using C/C++ or FORTRAN, Python, Mathematica or Matlab, specially in parallelized schemes..."
https://kr.indeed.com/viewjob?jk=ffd9cedb23e97344,파이썬SW 금융분야 특화 챗봇 개발 함께 할 엔지니어,파운트 서울 충정로역,,"처리 과정을 Python language로 구현 - Big data 처리를 위한 SW 개발 - Backend SW 구현, Messenger interface, DBMS I/F 구현 Requirement - Python..."
https://kr.indeed.com/viewjob?jk=cef60a5a4a42fe95,AD Performance Dev,LINE Plus corporation 성남 서현역,,"Java, Scala 중 2개 이상의 개발 언어에 능숙한 자 - 위 언어중 1개에 익숙하고 R 또는 Python 기반으로 분석에 능숙한 자 아래 요건 중 최소 한 가지 해당 - 대용량 트래픽 서버를 개발 및 운영한..."
https://kr.indeed.com/viewjob?jk=794e209e405f4fc0,지스트 블록체인경제센터(강남소재) 계약직연구원,광주과학기술원 광주 북구,,구직 명 블록체인 개발 블록체인 경제 블록체인 하드포크 1) SW프로그래밍 제작 경험자 2) Python/C/Java/Go 프로그래밍 가능자 우대사항 ① 국가보훈대상자(취업보호대상자) 및 장애인은 관련 법령...
https://kr.indeed.com/viewjob?jk=924d1be5b05890da,(Search) 쇼핑검색 AI 기술 개발 신입/경력사원 모집,NAVER 3.9 성남 정자동,,"design / Large-scale data processing 자격요건 및 우대사항 · C, Java, Python, Scala 등 하나 이상의 언어에 능숙 하신 분 · 위 채용분야 관련 2년 이상 실무 경험 또는..."
https://kr.indeed.com/viewjob?jk=cd826811aa0f2ab5,기술연구소-연구원,뷰온 서울 금천구,,"AI (DL/ML) 연구 [필수자격요건] - 학력 : 대졸이상, 관련학과 - 경력 : 신입~15년이하 - Python/C#/C++/Tensorflow [우대사항] - 비전 시스템 연구/개발경험 - 영상처리 시스템 개발경험..."
https://kr.indeed.com/viewjob?jk=cb286253682cb876,[던전앤파이터] 클라이언트 툴 프로그래머,네오플 서울 강남구,,"경험이 있으신 분 - DB / Web 기반 툴 제작 경험이 있으신 분 - 스크립트 언어로 작업을 해보신 분 ( python, php 등) - 외부 도구(3rd party tool)를 평가 / 적용 / 커스터마이즈 적용 능력이..."
https://kr.indeed.com/viewjob?jk=b245cdab72782813,커머스 플랫폼 개발 (데이터 엔지니어),LINE Plus corporation 성남 서현역,,에게 인사이트를 전파 - 데이터 분석 업무의 효율화를 위한 데이터 가공/추출 관련 개발 [자격요건] - Python 언어를 활용하여 Tensorflow Framework 기반 개발이 가능한 분 - 기본적인 ML 개념을...
https://kr.indeed.com/viewjob?jk=98c2229e57d4ee1f,전기전자컴퓨터공학부(바이오컴퓨팅연구실) 위촉연구원,광주과학기술원 광주 북구,,"국가보훈대상자(취업보호대상자) 및 장애인은 관련 법령에 의거하여 우대 ② 컴퓨터 프로그램밍 (Matlab, Python, C++등) 가능자 ③ 뇌파 측정 및 분석 2년 이상 경력 ➃ 딥러닝 기술 개발 경험 결격사유..."
https://kr.indeed.com/viewjob?jk=7cd74a7dccdd9077,[KSTEC] 통계/Analytics 경력사원,지식시스템 성남 분당구,,"개발 (SPSS, SAS, R, Python, Java 기반) 2. 기업용... 경력 3년 ~ 10년 [기술요구사항] 1. SPSS, SAS, R, Python, Java 등 데이터분석/AI개발 도구 사용 가능자 2. Java..."
https://kr.indeed.com/viewjob?jk=a3eab4406320cc22,"경력직 SI/SM 개발자 (JAVA, 커머스, Python)",씨인플러스 서울 금천구,,"신입 학력 대학졸업(2,3년) 성별 무관 기타 담당업무 경력직 SI/SM 개발자 모집 (JAVA, 커머스, Python) 커리어 양식 지원 상세모집요강 접수기간/방법 시작일 2020.5.4 (월) 마감일 2020.6..."
https://kr.indeed.com/viewjob?jk=f0651a7717791bc3,AR App Engineer,하이퍼커넥트 서울,,"지신 분 스스로 문제를 정의하고 해결책을 제시할 수 있는 분 Java, Objective C(Swift), Python 등 다양한 언어 경험 OpenCV 활용 (Image Processing 이해) 채용형태/근무시간 정규..."
https://kr.indeed.com/viewjob?jk=01b7f9d31e668163,Window Desktop Application Developer (C# / .NET),Bepro Company 서울,"연봉 40,000,000원 - 80,000,000원",참고 - React JS (Web) / Kotlin (Android) / Swift (iOS) - Python + Django - AWS lambda + API gateway - MySQL - Google Cloud...
https://kr.indeed.com/viewjob?jk=5c7b686e3fee8fa7,[Ericsson-LG Enterprise] WebRTC UC & Col...,에릭슨엘지 서울 금천구,,웹프로그래머>Servlet|인터넷·IT·통신·모바일·게임>웹프로그래머> Python|인터넷·IT·통신·모바일·게임>웹프로그래머>ASP|인터넷·IT·통신... 통신·모바일·게임>응용프로그래머> Python|인터넷·IT·통신·모바일·게임...
https://kr.indeed.com/viewjob?jk=383d4c8a7156b52b,[카카오 클라우드] 플랫폼 포털 개발자,카카오 4.2 성남 판교역,,"조건] 개발 경력 만 5년 미만 웹서비스를 구성하는 기술에 대한 이해 Java, JavaScript, Python 중 한 가지 언어를 능숙하게 사용할 수 있으신 분 [우대사항] 프론트엔드 개발 경력 3년 이상 IAM..."
https://kr.indeed.com/viewjob?jk=d48c925acb7e4187,IT기획(대리-과장급) 초빙 - 유명 유통사,로이스에이치알 서울,,"에 대한 이해도 . 프로젝트 관리 (PMP 등), 프로그래밍 언어 ( Python, Java 등), RDBMS (OCP 등) 관련 자격증 우대 . 영어... PMP 등), 프로그래밍 언어 ( Python, Java 등), RDBMS..."
https://kr.indeed.com/viewjob?jk=8eca56448e2574c8,TA,제이씨이 성남 분당구,,작성 능력 우대사항 - 업무 관련 해외 영문 기술 문서를 볼 수 있는 정도의 독해능력 - 테크니컬 아티스트 역할로 개발 경험 - 스크립트 능력 (maxscript/ python) - 다양한 플랫폼 / 장르 개발 경험
https://kr.indeed.com/viewjob?jk=0e17190c66936750,웹/앱 개발자 (경력),빌리콘 수원 장안구,,통신·모바일·게임>웹프로그래머> Python|인터넷·IT·통신·모바일·게임... 응용프로그래머>iOS|인터넷·IT·통신·모바일·게임>응용프로그래머> Python|인터넷·IT·통신·모바일·게임>데이터베이스·DBA>데이터아키텍처|인터넷...
https://kr.indeed.com/viewjob?jk=0479e1dd17962e77,[기술기획] DevOps 시스템 개발자,한국카카오은행 성남 분당구,,유한 분 · Docker 기반 서비스 구성/운영 경험을 보유한 분 · Python / Java / Golang 등 다양한 프로그래밍 언어 서비스 개발... 통신·모바일·게임>응용프로그래머> Python|인터넷·IT·통신·모바일·게임...
https://kr.indeed.com/viewjob?jk=ee5df99ada829d81,SI 프로젝트 개발자 (계약직 및 프리랜서),케이포시큐리티 서울 구로구,,래머>PHP |인터넷·IT·통신·모바일·게임>웹프로그래머>JAVA|인터넷·IT·통신·모바일·게임>웹프로그래머>백엔드|인터넷·IT·통신·모바일·게임>웹프로그래머>프론트엔드|인터넷·IT·통신·모바일·게임>웹프로그래머> Python
https://kr.indeed.com/viewjob?jk=c1037225077ca4da,데이터 분석가 (Business Intelligence Analyst),코스닥 상장 중견 게임기업 서울 강남구,"연봉 40,000,000원 - 70,000,000원","데이터 분석 결과를 쉽게 이해할 수 있도록 간결하고 명확한 의사전달 능력 [우대조건] * R, Python, Spark 등의 언어에 대한 이해도 * 모바일 앱SDK 연동 지원 업무 경험(Facebook, Admob..."
https://kr.indeed.com/viewjob?jk=c62caccf8ea03640,챗봇 서비스 - DM 및 시나리오 개발자,에스케이플래닛 성남 분당구,,인터넷·IT·통신·모바일·게임>빅데이터·AI(인공지능)>챗봇|인터넷·IT·통신·모바일·게임>빅데이터·AI(인공지능)> Python
https://kr.indeed.com/viewjob?jk=5d9a7b29a92fc3da,Data Architect,Amazon Web Services Korea LLC 서울,,"one or more programming languages (Java, JavaScript, Python, etc). · Current hands-on implementation experience required..."
https://kr.indeed.com/viewjob?jk=67ca30c143379281,Data Scientist III,Amazon Web Services Korea LLC 서울,,"development in languages like Java, Python, Scala. Experience working with RESTful... data processing with Python, R & SQL..."
https://kr.indeed.com/viewjob?jk=116009dbf59211ed,퍼즐데이터 역량있는 데이터 분석가,주식회사퍼즐데이터 서울 역삼동,,"데이터 마이닝 및 통계분석에 대한 전반적인 이해 3. 관련분야(산업공학, 통계 등) 전공 4. R or Python 사용 능력 * 이런 분은 더욱 좋아요. 1. 프로세스 마이닝 지식 보유자 2. 관련분야 대학원 전공 3..."
https://kr.indeed.com/viewjob?jk=8ae7c240ef7d5f0b,카카오 분석 플랫폼 경력 개발자,카카오 4.2 성남 판교역,,"구축 지원자격 대용량 데이터에 대한 실시간/배치 서비스 개발 운영 경험이 있으신 분 개발 경력 1년 이상 python, scala, druid, hadoop 등 다양한 환경에 적응 가능한 분 어떤 일이라도 중요하게 여기..."
https://kr.indeed.com/viewjob?jk=71c47ac87bb4087e,기술 인턴 인공지능 응용 연구/개발 인턴,써로마인드로보틱스 서울 관악구,,"6개월) (협의) *모집 절차: 서류 à인터뷰(오프라인) *지원 자격: 프로그래밍 언어 활용 능력: Python, C, C++ 중 1가지 이상 데이터구조, 알고리즘 과목 이수 머신러닝과 딥러닝의 기본 개념 이해 머신러닝..."
https://kr.indeed.com/viewjob?jk=38863766ef858bdf,현대오트론 차량용 반도체/전장SW 전문가 경력 상시,현대오트론 서울 강남구,,"능항목에 대한 이해 · C/C++, python, Verilog, VHDL... 차량전장관련 경험 및 지식 · 언어 활용능력(C/C++, JAVA, Python, Perl, Eclipse 등) · 영어 능통자 우대 · 모터제어로직..."
https://kr.indeed.com/viewjob?jk=e0506fe72721e74d,Data Engineer,하이퍼커넥트 서울,,"및 Data Pipeline 설계, 운영, Troubleshooting 경험 혹은 그에 상응하는 업무 능력 Python 혹은 Scala, SQL 실무 경험 담당 업무에 강한 오너십, 추진력 있는 리더십, 문제 해결을 위한..."
https://kr.indeed.com/viewjob?jk=f8b4db31ab69ea32,"R&D Engineer, Sr II",Synopsys 서울,,Experience in data structures and algorithms with C/C++ and Python - Experience in design and development of complex software...
https://kr.indeed.com/viewjob?jk=9072c5e755360b5c,성균융합원행정실(글로벌융합학부) 촉탁직원(연구원) 채용,성균관대학교 4.0 서울,,"자로 Computational Social Science를 연구하고 Python, R 등 강의, 연구가 가능한 자 * 우대사항 - 대학 학부 교육... 또는 통계학 박사학위 소유자로 Python, R 등을 이용한 중급 이상의..."
https://kr.indeed.com/viewjob?jk=3cc6771ec537db8c,웹 개발자 채용,꿈꾸는다락방 서울 공덕동,,"내는 분 - 프론트엔드 프레임워크 (React.js / Vue.js, Angular.js등) 사용가능하신 분 - Python 개발경험 - 빅데이터(데이터 마이닝/머신러닝/딥러닝) 관심 높으신 분 - Test-Driven..."
https://kr.indeed.com/viewjob?jk=f3b7d5dec9ee579f,[경력직 ] AI 시스템 풀스택 웹 개발자,마인즈랩 성남 분당구,,"시스템프로그래머시스템프로그래머 인공지능(AI).빅데이터인공지능(AI), 빅데이터, 머신러닝, DataAnalysis, Python 산업별(업종) SI.SM.ERP.CRM BigData, DataWarehouse"
https://kr.indeed.com/viewjob?jk=301a562b5b4d2b2e,Data Engineering Manager,레이니스트 서울,,"년 이상 Data Collection, Data Pipeline, Data Warehouse 구축 경험 보유 Python / Java(Scala) 를 이용하여 데이터 분석 툴 개발 가능 스트리밍 또는 배치 Data 기술 (예..."
https://kr.indeed.com/viewjob?jk=5123207a169f90eb,Software Developer - Front-End / Back-En...,AITRICS 서울,,"purpose programming languages including C++, Java, Javascript, Python. Eager to learn a new programming language and machine..."
https://kr.indeed.com/viewjob?jk=fd381f2481608bb1,Ericsson-LG Enterprise 경력 개발자 (추가 ),에릭슨엘지 서울 금천구,,웹프로그래머>Servlet|인터넷·IT·통신·모바일·게임>웹프로그래머> Python|인터넷·IT·통신·모바일·게임>웹프로그래머>ASP|인터넷·IT·통신... 통신·모바일·게임>응용프로그래머> Python|인터넷·IT·통신·모바일·게임...
https://kr.indeed.com/viewjob?jk=45a8d1ec64004328,"[해외취업] IT 프로그래머,web개발 엔지니어,Java프로그래머,인프라...",SEAGILE 대한민국,"연봉 35,100,000원 - 70,000,000원","외 아래 언어, 스킬 보유자 *개발환경 업무 범위 1.웹개발 엔지니어 -언어: Java、Spring,PHP、 Python, Ruby、java script, JQuery등 -DB: MySQL, Oracle -OS: Linux..."
https://kr.indeed.com/viewjob?jk=8c8700db243d1a3c,"Application Engineer, Sr II",Synopsys 서울,,"Working knowledge of scripting languages like TCL, Unix Shell, Python, or Perl. Prior AE/design experience is a plus. Working..."
https://kr.indeed.com/viewjob?jk=de210ffb5a9ee0c4,카카오톡 신규 서비스 서버 개발자,카카오 4.2 성남 판교역,,"구조 개선, 운영 경험 데이터베이스와 캐시 연동 (Redis, memcached, MySQL 등) Kotlin, Python 언어 경험 네트워크 프로그래밍 경험 MQ, Kafka, Elastic Search 등의 도입, 연동..."
https://kr.indeed.com/viewjob?jk=a3a65a4d59061430,위시켓과 함께할 서버개발자님,위시켓 서울 강남구,,"를 활용한 정적 페이지 연계 - Docker, Jenkins 등을 활용한 CI/CD 개선 자격조건 - Python 기반의 프레임워크를 이용한 웹서비스 구축 또는 운영 경험 - Django 기반의 웹 서비스 구축 또는 운영..."
https://kr.indeed.com/viewjob?jk=8a15326f80e07c08,Customer Operations Engineering Manager,Success Korea 대한민국,,experience in C++ or Java and Python - Network monitoring and application... C++ or Java and Python - Network...
https://kr.indeed.com/viewjob?jk=d9a8d22b38653d34,[인재풀] Central Development Services,Electronic Arts 서울,,"제안 및 구현할 수 있는 능력 - C++, C#, Java, Object C 등의 프로그래밍 언어 및 Python, Shell Scripts, Ruby 등 스크립팅 능력 - 테스트 자동화, CI 시스템 등의 개발 및 관리..."
https://kr.indeed.com/viewjob?jk=8aeedb3a2dba74b6,Software Test Engineer for HANA Engine I...,SAP 4.3 서울,,"processes Knowledge of Git or other version control, Python, SQL Understanding of modern computer architecture, operating..."
https://kr.indeed.com/viewjob?jk=701b04f0ab18c3d0,Software Engineer - Real-time Chat Platf...,Sendbird 서울,,"knowledge of Python or Java 2+ years... Unix/Linux systems Understanding of Python, Java, and Event-Driven Frameworks..."
